{
  "$schema": "https://json-schema.org/draft/2020-12/schema",
  "$id": "https://github.com/wrightkit/athena/blob/main/docs/scenario.schema.json",
  "title": "athena scenario, versions 1 and 2",
  "type": "object",
  "required": ["scenarioVersion", "seconds", "players"],
  "additionalProperties": false,
  "properties": {
    "scenarioVersion": { "enum": [1, 2] },
    "seconds": { "type": "number", "exclusiveMinimum": 0 },
    "players": { "type": "array" },
    "events": {
      "type": "array",
      "items": { "$ref": "#/$defs/event" }
    },
    "expect": {
      "type": "array",
      "items": { "$ref": "#/$defs/expectation" }
    },
    "random": { "$ref": "#/$defs/random" },
    "serverLoad": { "$ref": "#/$defs/serverLoad" },
    "map": {
      "type": "string",
      "minLength": 1,
      "description": "The map Current Map reads: a Map member id of the workshop-rs catalog (for example KINGS_ROW) or its en-US spelling, matched case-insensitively — the same form a player's hero takes. Constant for the run; a Current Map read with no field is a missing input."
    },
    "objectives": {
      "type": "array",
      "items": { "$ref": "#/$defs/position" },
      "description": "The objective positions Objective Position reads: entry i is the position of objective index i — the evaluated argument, a number or a boolean under the number coercion (False/True as 0/1). Supply the field whole or not at all: a read with no field, or an index naming no entry, is a missing input."
    }
  },
  "allOf": [
    {
      "if": { "properties": { "scenarioVersion": { "const": 1 } } },
      "then": {
        "properties": {
          "players": { "items": { "$ref": "#/$defs/playerV1" } }
        }
      },
      "else": {
        "properties": {
          "players": { "items": { "$ref": "#/$defs/playerV2" } }
        }
      }
    }
  ],
  "$defs": {
    "id": { "type": "string", "minLength": 1 },
    "time": { "type": "number", "minimum": 0 },
    "random": {
      "type": "object",
      "required": ["seed"],
      "additionalProperties": false,
      "properties": {
        "seed": {
          "type": "integer",
          "minimum": 0,
          "maximum": 18446744073709551615,
          "description": "Unsigned 64-bit seed. Write it as an integer literal: the loader rejects a decimal point or exponent, so 1.0 and 1e3 fail although 'integer' admits integral-valued numbers."
        }
      }
    },
    "serverLoad": {
      "type": "object",
      "required": ["average", "peak", "current"],
      "additionalProperties": false,
      "properties": {
        "average": { "type": "number" },
        "peak": { "type": "number" },
        "current": { "type": "number" }
      },
      "description": "The numbers Server Load Average, Server Load Peak and Server Load read, constant for the run. Supply the field whole or not at all: a partial object is malformed, and a read with no field is a missing input."
    },
    "position": {
      "type": "object",
      "required": ["x", "y", "z"],
      "additionalProperties": false,
      "properties": {
        "x": { "type": "number" },
        "y": { "type": "number" },
        "z": { "type": "number" }
      },
      "description": "The player's position the position-reading values return: x left, y up, z forward. Supply it whole or not at all: a partial object is malformed, and a read with no field is a missing input."
    },
    "facing": {
      "type": "object",
      "required": ["horizontal", "vertical"],
      "additionalProperties": false,
      "properties": {
        "horizontal": { "type": "number" },
        "vertical": { "type": "number" }
      },
      "description": "The player's facing the facing-reading values use: horizontal and vertical degrees, horizontal 0 forward (+z) increasing left, vertical 0 level increasing downward. Supply it whole or not at all: a partial object is malformed, and a read with no field is a missing input."
    },
    "stateVector": {
      "type": "object",
      "required": ["x", "y", "z"],
      "additionalProperties": false,
      "properties": {
        "x": { "type": "number" },
        "y": { "type": "number" },
        "z": { "type": "number" }
      },
      "description": "A `state` vector: x left, y up, z forward — the same components `position` takes. A partial object is malformed."
    },
    "value": {
      "type": ["null", "boolean", "number", "string", "array"],
      "items": { "$ref": "#/$defs/value" }
    },
    "values": {
      "type": "object",
      "additionalProperties": { "$ref": "#/$defs/value" }
    },
    "playerState": {
      "type": "object",
      "additionalProperties": false,
      "properties": {
        "health": { "type": "number", "description": "What Health reads." },
        "maxHealth": { "type": "number", "description": "What Max Health reads." },
        "normalizedHealth": { "type": "number", "description": "What Normalized Health reads." },
        "velocity": { "$ref": "#/$defs/stateVector", "description": "What Velocity Of reads; Speed Of derives its length. Supply it whole or not at all." },
        "eyePosition": { "$ref": "#/$defs/stateVector", "description": "What Eye Position reads. Supply it whole or not at all." },
        "ultCharge": { "type": "number", "description": "What Ultimate Charge Percent reads." },
        "isDead": { "type": "boolean", "description": "What Is Dead reads." },
        "isUsingUltimate": { "type": "boolean", "description": "What Is Using Ultimate reads." },
        "isMeleeing": { "type": "boolean", "description": "What Is Meleeing reads." },
        "isFiringSecondary": { "type": "boolean", "description": "What Is Firing Secondary reads." },
        "isInAlternateForm": { "type": "boolean", "description": "What Is In Alternate Form reads." },
        "isCommunicatingEmote": { "type": "boolean", "description": "What Is Communicating Any Emote reads." },
        "isInSpawnRoom": { "type": "boolean", "description": "What Is In Spawn Room reads." },
        "isDummy": { "type": "boolean", "description": "What Is Dummy Bot reads." },
        "isMoving": { "type": "boolean", "description": "What Is Moving reads — supplied, never derived from velocity." }
      },
      "description": "The player-state values the no-extra-argument player reads return, keyed by the accepted ids. Each value is scenario-supplied, not simulated. A key the program reads but the map does not list is a missing input naming `state.<key>`; an unknown key or a wrong type is malformed."
    },
    "playerV1": {
      "type": "object",
      "required": ["id"],
      "additionalProperties": false,
      "properties": {
        "id": { "$ref": "#/$defs/id" },
        "hero": { "type": "string", "minLength": 1 },
        "team": { "enum": ["team1", "team2"] },
        "host": { "type": "boolean" },
        "state": { "$ref": "#/$defs/values", "description": "Version 1: the player's variables. Renamed to `vars` in version 2." },
        "buttons": {
          "type": "object",
          "additionalProperties": { "type": "boolean" }
        },
        "position": { "$ref": "#/$defs/position" },
        "facing": { "$ref": "#/$defs/facing" }
      }
    },
    "playerV2": {
      "type": "object",
      "required": ["id"],
      "additionalProperties": false,
      "properties": {
        "id": { "$ref": "#/$defs/id" },
        "hero": { "type": "string", "minLength": 1 },
        "team": { "enum": ["team1", "team2"] },
        "host": { "type": "boolean" },
        "vars": { "$ref": "#/$defs/values", "description": "The player's variables — the version-1 `state` field renamed." },
        "state": { "$ref": "#/$defs/playerState" },
        "buttons": {
          "type": "object",
          "additionalProperties": { "type": "boolean" }
        },
        "position": { "$ref": "#/$defs/position" },
        "facing": { "$ref": "#/$defs/facing" }
      }
    },
    "event": {
      "type": "object",
      "required": ["kind", "time"],
      "additionalProperties": false,
      "properties": {
        "kind": { "type": "string", "minLength": 1 },
        "time": { "$ref": "#/$defs/time" },
        "eventPlayer": { "$ref": "#/$defs/id" },
        "values": { "$ref": "#/$defs/values" }
      }
    },
    "expectation": {
      "oneOf": [
        {
          "type": "object",
          "required": ["kind", "name", "value"],
          "additionalProperties": false,
          "properties": {
            "kind": { "const": "global" },
            "name": { "$ref": "#/$defs/id" },
            "value": { "$ref": "#/$defs/value" }
          }
        },
        {
          "type": "object",
          "required": ["kind", "player", "name", "value"],
          "additionalProperties": false,
          "properties": {
            "kind": { "const": "playerVariable" },
            "player": { "$ref": "#/$defs/id" },
            "name": { "$ref": "#/$defs/id" },
            "value": { "$ref": "#/$defs/value" }
          }
        },
        {
          "type": "object",
          "required": ["kind", "tick", "text"],
          "additionalProperties": false,
          "properties": {
            "kind": { "const": "log" },
            "tick": { "type": "integer", "minimum": 0 },
            "text": { "type": "string" }
          }
        }
      ]
    }
  }
}
