{
  "scenarioVersion": 1,
  "seconds": 2,
  "players": [
    {
      "id": "p1",
      "hero": "ana",
      "team": "team1"
    }
  ],
  "events": [
    {
      "kind": "playerDealtFinalBlow",
      "time": 1,
      "eventPlayer": "p1"
    }
  ],
  "expect": [
    {
      "kind": "global",
      "name": "score",
      "value": 1
    },
    {
      "kind": "playerVariable",
      "player": "p1",
      "name": "streak",
      "value": 1
    }
  ]
}
